,Count,Category,Start_Date,Title,Content
212,723,보건복지,2019-10-24,액상형 전자담배 대처 강력 지시 이유가 무엇인지  진정한 목적이 무엇인지 사용자입장에서 묻고싶습니다.,"우선 글을 시작하기에 앞서 글 쓴이의 위치를 이야기 하겠습니다.

전자담배 판매자. 아닙니다.
전자담배 수입업자. 아닙니다.
전자담배로 연초금연을 성공하고 하나의 문화로서 건강을 지키고 있는 1인 입니다.
다른나라 예시 들지 않겠습니다. 대한민국이 전자담배를 가장 오래  빠르게 
상용화 시키고 사업화 시켜온 나라인데 왜 다른 나라를 기준점으로 잡아야 합니까
다른 나라가 우리나라는 기준점으로 잡는게 맞는것이죠.

전자담배가 국내에 본격적으로 사업화 된것은 무려 10년이란 기간이 넘습니다.
중국에서 최초로 제작이 되어 상용화 되면서 전세계 어느나라도 빠르게 사업화 시키지 않았을때
우리나라 대한민국이 가장 빠르게 사업화에 동참하며 프렌차이즈 사업으로 빠르게
확장된 사업입니다.

10년이 넘는 기간동안 수많은 사람들이 전자담배를 통해 금연을 하고
때론 금연에 실패하여 다시 연초사용으로 다시금  돌아 간 사람들도 많았습니다.

이 긴 기간동안 과연 이나라의 정책은 어떠했었던가요?
기기에는 KC인증을 받게 하는 정책  제대로된 정책이었다고 생각합니다.
액상을 갑자기 식료품  유해화학물로 분류한다며 향료  니코틴을 섞어 사용하던것을
완제품으로 판매하라고 한 정책  나쁘지 않았던 정책이라 생각합니다.
구매자  판매자가 임으로 니코팅 농도를 조절하는것은 위험성이 더 크게 따르니까요.

이렇게 10년이란 기간을 한번씩 각 행정부처간의 규약으로 잘 컨트롤 할 부분은 
해왔다고 생각하는데

작년말부터 미국의 가장 거대한 담배회사가 액상형 전자담배를 인수하면서
그 특정 담배가 전세계적으로 붐을 일으키니 갑자기 이때다! 하는거 처럼
검증안된 제대로된 자료도 없는 수많은 기사들이 쏟아져 나오고 있는거 우리가 다 보고 있습니다.

100의 1개 정도의 기사만 전자담배가 일반 담배보다 낫다라는 기사일뿐
그외 모든 기사는 전자담배를 피고 폐질환을 얻은 미국에서는 전담배를
전면 금지 시켰다라는 카더라급 기사 역시나 카더라니 이젠 특정 대형 마트에서 판매금지
그리고 서서히 밝혀지는 사실은 전자담배만의 문제가 아닌 전자담배라는 특정 기재를 
악용하여 마약류 제품을 흡입하여 생긴 문제라고 서서히 베일이 벗겨지고 있는 상황임에도

우리 정부는 전자담배 판매를 금지시키겠다 국민들의 불안을 해소할 방법을 강구중이다 라는 
기사만 쏙쏙들이 나오고 있는점이 참 의아해서 이런 청원글을 쓰고 있는 중입니다.

불법이 무엇인가요?
법이 있고 그 법을 준수하지 않고 지키지 않는것이 불법이라고 우리는 다 정의 내리고
인지하고 있습니다.

전자담배가 법으로 사용하지 말라 라고 규정되어있나요?

지금 기사들을 보면 현재 전자담배를 사용하는 사람들을 모두 범죄인화 시킨다는 
생각은 안하기에.  국회의원분이 국민들이 전자담배 문제로 불안에 떨고있다
라고 이야기한것을 기사화 시킨것이겠죠
국민들이 불안에 떤다? 이정도 이야기를 할려면 엄청난 범죄 누구다 인정할만한
공감대를 형성할만한 극악 범죄일때 책임을 지고 이야길 해야 하는 내용 아닐까요?

정말 불안에 떨고 있는게 맞나요? 그 근거는 어디에서 나오는것인가요?
언제부터 우리손으로 뽑은 국회의원분들이 특정 자료도 하나 없이 기사만 보고
이렇게 국민들을 불안에 떨게 하고 있다 라고 언급을 하며 이슈화 시키셨는지요?

미국은 주마다 법이 다르고 마약류 취급에서도 우리 나라와 기준이 다르고
법체계가 다름에도  미국에서 문제가 생기면 국내에서도 동일하게 문제가 생기는것인가요?

도대체 불안에 떨만큼 전자담배가 문제가 된다는 근거자료들은 하나도 준비하지 않은 상태에서
단순히  다른 나라에서 발생한 문제를 그릇된 일반화의 오류를 범하듯 
우리보다 더 큰 나라가 저러니 우리나라도 이렇게 가자..라고 생각을 하시는것인가요?

그냥 솔직히 이야기를 하고 수긍할수 있는 방향을 올바르게 제시하고 만들어야 하는것이
국민이 뽑은 대표들이 할 일 아닌가요?

그냥 겁주고 위협하듯 니들이 써온건 불법적인거 같다.
니들이 써온 이 전자담배 때문에 국민들이 위협받고 있다.

라고 이야기하는 말의 끝은  목적은 무엇인가요?
최종 목적지가 궁금해 집니다.

현 국내 전자담배 시장 아니 전세계적으로 전자담배가 이렇게 크게 빠르게 
성장할꺼라 예측을 못했기에. 제대로된 법이 제정되어 있는 나라는 단 한곳도 없습니다.

그렇기에 실질적인 부분을 이야기를 해야지 무조건 적으로 목적을 위해 
위협하듯 기사화 시키고 이런 기사로 전자담배를 사용하는 사람들 사용하지 않는 사람들 
모두를 다 불안에 떨게 하는게  맞는 방향 아닌지요?

액상에 대한 세금을 부과할 방법이 없다  이게 주 논점 아닌가요?

이야기를 할때는 주된 논점을 서두에 두느냐 말미에 두느냐에 따라 
전개하는 방식은 달라지겠지만 
누구나 결말을 알고 있는 이야기는 주된 이야기를 뒤로 뺄수록 
더의혹만 생기고 흥미를 잃고  심지어 반발심만 생기게 하지 않던가요?

이제껏 이 전자담배 시장이 액상에 대하 부가세 외에 세금을 내지 않았던게 아니라
법이 없었기에 부가세만 내고 영업을 해온것임에도
주된 논점은 세금 이라고 말하기는 어려우니 
이젠 전자담배  위험하다  국민들이 불안에 떨고있다 이건 참 유치한 선택이 아닐까 의심스럽습니다.

담배에 부가되는 세금은
1. 국민건강 증진부담금
2. 담비소비세
3. 지방교육세
4. 개별소비세
5. 부가세
이렇게 구성이 되죠. 그런데 전자담배는 담배잎에서 추출되는 니코틴에서 만 세금을 부과하도록
제정해둔 담배법에서 벗어나는 니코틴이니 14는 전혀 내지 않고 5번만 내왔으니
더욱이 2년내에 전자담배가 예상치도 못하게 이슈화 되고 성장이 되고 있으니 
이러다가는 안되겠다..세금을 부과할 근거를 만들어 보려한다.

이게 솔직한 이야기 아닌가요?

판매자분들도 법이 없었으니 5번의 세금을 낸거지 다 법을 어기고 불법으로 영업을 해온게
아닌데 국민들이 불안에 떨고 있다라는 말은 틀린것이고 
이제껏 전자담배 판매업을 생계로해온 소상공인들이  이렇게 국회의원분들이 
전자담배를 국민불안을 야기하는 무서운 제품으로 이야기를 하고 기사화 시키니
먹고살 길이 막막해질꺼 같아 불안에 떨고 있다가 맞는 이야기 아닌가요?
이제껏 기사들을 보면 전자담배 판매자들은  국민의 건강을 위협하는 범죄자 수준으로 
연이어 나오고 있으니까요

현 정부는 최저임금 인상부터 소상공인들을 응원하고  서민들의 경제에 힘을 실어 주겠다 한 정부 아니었던가요?

그냥 대한민국보다 큰 나라가 이거 위험하다! 문제가 있는거 같다! 라고 
역시 제대로된 통계나 근거자료없이 기사회 시킨것을 그대로 퍼와서 국내에 옮기고
이걸 다시금 우리손으로 뽑은 국회의원님들이 국민의 건강을 위협하여 불안에 떨고있다 
라고 해야할 만큼 큰 문제이자 범죄인가요?

그냥 솔직한 정부를 원합니다.
그냥 솔직한 국민의 대표를 원합니다.

담배값이 2500원에 4500원으로 올라갔을때도 뭐 이런 경우가 있나 하면서
결국 지금은 다 적응하고 구매하고 판매하고 잘 살고 있잖습니까?

이제껏 담배에만 부과해왔던 저많은 1번4번의 세금을 
합리적인 선으로 조정하여 전자담배에도 적용할수 있는 법안을 만들고
합리적인 개도기간을 부여하고 

이런 이유로 앞으로 전자담배도 담배의 일종으로 분류하여 합리적인 세금을
부과하겠으니 인지하고 준수해 달라 라고 한다면 

우리손으로 뽑든 대표인  국회의원 대통령님의 결정을 이해못하고 넘어갈만한
어리석은 국민들이 아닌건 아실꺼라 생각하는데

주된 포인트는 절대 언급하지 않고 무작정 미국에서 폐질환자가 발생했으니
우리나라도 그럴꺼같으니 
이것은 국민들의 건강을 위협하고 불안에 떨게하는 위험물 이라고 이야기를 하는것은
전자담배를 사용하지 않는 사람들에게마저 공감을 얻기 어려운 루머를 쇄뇌시켜
합리화인척 밀어 부치는것 밖에 안된다고 생각합니다.

근거자료 통계  제대로된 증거 하나없이 무작정 이렇다 카더라..
라는 말로만으로 금하려하고 제재하려 한다면
누가 납득을 할수 있을런지요?

판매금지  현실적 대안이 아닌거 국회의원분들도 잘 알껍니다.
국민건강 위협 불안에 떨게 한다. 이런 카더라 말고 정확한 자료  근거 통계없이
법원에서도 극한 상황 아니면 인정하지 않는 정황증거 심증만으로 
전자담배업을 생계로 하고 있는 소상공인들을 범죄인화 시키지 마시고
잘 사용하여 건강을 지키면서 금연을 영위하고 있는 소비자들도 범죄인화 시키지 마시고

제대로된 자료들로 이제껏 정부가 신경쓰지 못하고 부가하지 못했던 
세금부분을 합리적은 선으로 재정비하여 법을 만든후 
국민들이 납득할수 있는 방향을 잡아 주시길 바랍니다.

그 전까지는 부디 전자담배 판매자 사용자들을 
국민건강을 위협하고 불안에 떨게하는 파렴치한 존재화 시키는
이야기. 기사는 자재해 주시는게 옳바른 대표들이 나아갈 방향이라 생각합니다."
213,"12,482",정치개혁,2019-10-23,황교안의 내란죄 즉각 수사요청,".
지금 대한민국 미래의 운명이 결정될
분수령에 도달해 있습니다
오늘 국감장에서 폭로된
황교안의 계엄령 준비와
이 사건을 덮어버런 윤석열 사건은
하늘이
문재인 정권에게 준
둘도없는 절호의 기회입니다

문재인 대통령은
당장 윤석열을 
내란모의 범죄은닉과 직무유기죄로 
파면하고
국정원으로 하여금
황교안과 윤석열을 긴급체포 하여
내란모의 죄에 대한 수사를 시작해야만 합니다

그리고 이 사건에 연루된
자한당 국회의원과 당직자들도 역시
긴급 체포하여 같이 수사해야만 됩니다
동시에 검찰을 뿌리부터 개혁하고
다시는 검찰출신들이
정치에 나서지 못하도록 차단해야만 됩니다

국민들이 손에 쥐어준 권력을
제 때에 
올바로 사용하지 못한다면
하늘과 국민들은
또 다시 이런 기회를 주지 않을 것입니다
문재인 대통령은 우유부단 하지 마시고
민주당은 
과감하고 단호하게 이 사건을 처리하길 바랍니다
."
214,170,경제민주화,2019-10-23,상폐위기에 처한 주*****의 재감요청을 거부한 **회계법인,"14000의 주주로 구성된 주*****가 지난 3월 감사보고서에서 재무구조의 불투명으로  거래정지 되었다.
그 후 각고의 노력  끝에  금강원의 감사를 무사히 통과 했으며 국내4대 법인 회계법인중 하나인 **회계법의 자문을 거쳐 불투명 헸던  자료를 모두 수정 보강했으며..재감사하는 데  이상이 없을 거라는 검증도 받았다.

7월에 모든 자료를 마치고 **회계법인에게 재감사를 요청했지만  10월20일인 현재까지도  특별한 이유없이  거부하고 있다.   금강원직원도 재감요청 건의를 했지만 현재까지 거부하고 있다.
9년간 **회계법인에게 하고 거래하고 있는 관계로 모든자료가  거기에 있으며 다른 회계법인으로 바꾸면 많은 시간과 비용이 추가 되므로 바꿀 수가 없다.

법률상 굳이 재감에 대한 의무는 없다는 이유로 거부하고 있는 **회계법인..
하지만 14000명의 주주는 주식 거래정지로 엄청난 정신적 금전적으로 고통을 받고 있으며.. 도의적 사회윤리적으로  주*****의  재감사요청을 받아 들어서 재거래를 하게끔 요청합니다.

 본 게시물의 일부 내용이 국민 청원 요건에 위배되어 관리자에 의해 수정되었습니다"
215,"2,142",교통/건축/국토,2019-10-23,분양가상한제 적용 반대 및 유예기간 연장을 위해 탄원드립니다,"존경하는 대통령님
저희 개포1단지아파트는 1982년 완공되어 노후화로 2003년 6월23일에 재건축 판정을 받고 2017년 관리처분인가후 모든 세대가 이주하여 현재 석면조사후 철거를 앞두고 있습니다.

최근 10월 22일 국토교통부가 국무회의에서 민간택지 분양가 상한제 시행을 위한 주택법시행
령 개정안이 처리됐다고 발표하였습니다. 관리처분계획인가를 이미 받은 재건축단지도 분양가상한제 적용에 포함시키는 무지막지한 개정이 아닐 수 없습니다. 비록 시행령 시행후 6개월까지 입주자 모집공고를 신청하면 상한제 적용대상에서 제외한다고는 하나 이것은 빛좋은 갯살구에 지나지 않은 말입니다. 상한제 적용지역을 정할 때 동 단위 등으로 지역을 핀셋 지정한다는 둥 6개월 유예기간을 줘도 빠져나가지 못하는 단지를 미리 정해 놓았다는 둥 하는 소문이 마치 저희 개포1단지를 목표로 하는 듯한 느낌이 우리 개포1단지 조합원들만 드는 것은 왜 일까요? 

탄원합니다!  관리처분계획인가를 받은 재건축 단지는 분양가상한제 적용 대상에서 배제해주시기 바랍니다. 만일 이것이 어렵다면 적어도 유예기간을 1년 이상 주어야 할 것입니다. 이는 헌법 제13조 제2항에 따르면 모든 국민은 소급입법에 의하여 재산권을 박탈당하지 아니한다라고 되어있습니다. 따라서 분양가상한제 소급적용은 위헌의 소지가 다분하다 봅니다. 위헌의 소지를 없애고 싶으면 적어도 1년 이상의 유예기간은 필요하다 생각됩니다.

분양가상한제 확대 적용을 위해 주택법 시행령 개정에 들어가고 더욱이 그 시행기준 시점을 관리처분인가가 아닌 모집자공고 기준으로 하려는 상식 이하의 처신에 대해 강력한 반대의사를 표시하고자 탄원드립니다. 이는 분양가상한제를 소급 적용할려는 것으로 위법적이고 부당한 처사입니다. 종전 법률에 따라 적법한 절차에 의거 추진중인 사업에 대하여 법개정을 통해 일방적으로 소급적용하여 사업추진을 실질적으로 막는 것은 사유재산을 침해하는 위법적이고 부당한 정책입니다. 

이러한 정책은 공급확대 등 부동산시장 안정을 위해 기여하는 기존 아파트 조합원에게는 시세보다 땅을 강제로 싸게 팔게하여 피해를 입히고 일반분양자에게는 로또수익으로 막대한 수익을 안기겠다는 정책인데 이는 반드시 철회되어야 합니다. 조합원 전체 분담금이 당초 관리처분인가때 보다도 무려 5000억원 이상 추가 발생하는데한세세당 1억 이상 어떻게 재건축을 진행하란 말씀인가요? 백번 양보하더라도 최소한 관리처분인가가 난 단지는 적어도 1년 이상의 유예 기간을 주는 것은 너무나도 당연한 이치입니다.

존경하는 대통령님 
이런 부당함을 헤아려주셔서 부디 오랫동안 재건축으로 자기집에 입주하려는 2만여 주민들에게 찬물을 끼얻는 모순된 불합리함을 제거해주시기 간곡히 탄원드립니다. 로또복권같은 분양을 위해 기존 주민인 조합원이 피해보는 우를 범하는 것은 누구도 바라지 않는 일이 아니겠습니까? 다시한번 간곡히 탄원드립니다. 분양가상한제 소급적용은 없어야 합니다. 적어도 유예기간은 1년 이상의 기간을 주는 것이 합리적인 길이라 생각합니다.  감사합니다."
216,984,교통/건축/국토,2019-10-23,용인시 난개발허가및 시공사 회포로부터 주민들을 살려주세요,"안녕하세요 용인시 상현동 ** 아파트에 살게 된지 올해로 13년차인 주민입니다. 서울서 겨우겨우 돈을 마련해서 내집마련의 꿈을 위해 용인으로 내려왔습니다. 당시 앞에는 논밭에 도로도 교통도 잘 되있지 않았지만 자녀교육도 잘 될거라고 생각해서 이사왔습니다. 버스정류장도 멀고 다들 학교를 가기위해 15분씩 걸어서 통학해도 예쁘게 꾸며온 안식처인 우리집에 만족하며 살아온지 13년이 되었네요.

그런데 얼마전부터 시작된 공사로 아침마다 전쟁입니다. 각 동으로 다닐수 있는 유일한 길은 차 하나도 겨우 지나갈 아파트단지 안의 도로뿐입니다. 그 도로를 엄청나게 큰 공사차들이 밀고들어와 주민들의 출근과 아이들의 등교를 막고있습니다. 이를 막고자 주민들이 꾸린 대책위원회와도 계속적으로 충돌하고 심지어 용역들까지 투입되어 밤새 보초를 서 불안에 떨고있으며 무력까지 행사하여 주민을 입원하게 까지 만들고 있는 중입니다.

저희 아파트는 하나의 아파트 단지처럼 보이지만 아파트 5개 동이 개별 건축허가를 받아 각각 지어졌습니다. 이른바 쪼개기 수법을 통해 20세대 미만으로 아파트를 나눠 주택법상 사업계획승인 없이 1999년 건축됐습니다.

쪼개기로 지어진 아파트 단지 안은 좁은 도로에 인도도 없고 놀이터와 관리사무소 같은 주민 편의시설도 없습니다. 입주당시 쪼개기 분양의 피해를 호소하며 아파트 진출입 도로를 용인시가 기부채납 받아 공도로 만들어 줄 것을 요구했지만 당시 용인시는 계획도로가 없다는 이유로 도로 기부채납을 거부했습니다.

결국 아파트 진출입 도로는 입주민 60여명이 돈을 모아 공동으로 매입하고 가로등 등을 직접 설치하며 20년 동안 관리해 왔습니다. 근데 그 아파트 안 도로가 건축법상 길거리같은 공공도로라며 공사차를 들여놓고 있는 것입니다. 

저희 아파트 단지안 공사지는 입주전부터 있던 알박기 주택지으로서 한 부부가 농사를 짓겠다며 주민들에게 호소하여 단지내 도로를 사용할 수 있게 허락을 주었던 곳입니다. 그러나 이곳을 팔아버린 후 2015년에 건축사에서 용인시 오피스텔 건축허가를 받아 그날부터 지속적으로 저희와 충돌중입니다. 4년동안 공사 시행과 유효성에 관한 11회의 재판을 했고 저희가 승소하여 도로 사용에 대해 아파트주민과의 협의가 필요하다는 판결에도 불구 매번 막무가내로 포크레인을 밀고 들어와 주민들이 몸으로 막다 다치고 있는 상황입니다. 

그곳엔 상하수도 시설도 연결조차 불가한 곳입니다. 이러한 맹지를 주거지로 사용하기 위해선 저희 도로를 사용해야합니다. 그 부지 앞은 원래 큰 컨테이너로 된 마트가 있던 곳이었습니다. 공사부지 진 출입로가 없다는 소리를 듣고 다른 시공사가 매입하여 높은 금액을 요구하고 있다고 합니다. 저희는 이 공사때문에 하루아침에 마트도 잃고 불편함도 얻고 안전도 위협받고 있습니다.

저희 아파트 바로 옆에는 초등학교가 자리하고 있습니다. 베란다에서 초등학교가 보이고 교시마다 끝나고 시작하는 종소리가 들릴정도로 가깝습니다. 
저희집으로 공사차가 오고가는 길은 고속도로를 타고나와 초등학교를 지나는 좁은 2차선입니다. 이곳 주민뿐만 아니라 매일 그 길로 다니는 공사차 바퀴보다도 작은 아이들의 등 하굣길도 위험한 상황입니다. 

아이들 웃음소리가 들리는 이 아름다운 동네를 망치는 용인시의 탁상행정 난개발과 시공사의 막무가내 공사집행을 막아주세요.. 부탁드립니다.

 본 게시물의 일부 내용이 국민 청원 요건에 위배되어 관리자에 의해 수정되었습니다"
217,788,교통/건축/국토,2019-10-23,신생에너지 REC 시장의 문제점을 개선해주세요.,"현재 신재생에너지 지원제도 RPS 시스템의 신재생에너지 인증서 REC 가격이 많이 하락되었습니다. 엊그제만해도 5만원이었던게 오늘은 4만원. 하루하루가 급락하고 있습니다.12만원 4만원. 이는 양방향매매 시스템의 구조적 모순점과 함께 폐기물소각 혼소발전소에도 REC를 부여하는등 신재생에너지 와 관련없는 부문에도 지원이 이루어져 의무매입사의 편법과 담합을 부추기는 여러가지 착오와 부실때문이라고 생각합니다. 정부의 권장정책으로 어렵게 대출받아 진행한 신재생에너지 사업이 현재는 대출금 상환도 어려운지경에 이르렀는데도 개선의 기미는 보이지않고있습니다. 지금 상황으로는 대출금 상환은 고사하고 이자납부와 생활고에 시달리게 생겼습니다.
RPS제도의 보완과 개선으로 소규모사업자의 사업성을 최소한이라도 보장받을수있도록 REC하한가를 설정하고 즉시 폐기물소각발전소에대한 REC를 없애야합니다. 대부분의 사람들은 소규모로 하는 노인분들로 자세한 상황은 모르시고 애만 타고 계십니다. 
전국 5만명의 소규모 태양광 사업자의 생계가 달려있습니다.   부디 REC하한가를 설정해 주시고 폐기물소각발전소에 대한 REC를 없애주세요."
