,Count,Category,Start_Date,Title,Content
103,124,행정,2019-10-31,노동부의 업무 과실로 인한 행정처분,"귀 사업장은 고용촉진 장려금을 지원받은 근로자의 이직사유가 계약만료로 되어있어 이같이 처분 통보를 받았습니다.  
고용촉진지원금 지급에 대해 담당했던 기업지원팀 직원은 필요한 서류 및 현장 점검까지 오셔서 조리원들과 만나 최종 확인까지 하시고 가셨습니다. 
이 두분은 정규직으로 채용하여 귀사와 거래관계에 있는 영업장 폐업으로 인해 퇴사를 하게 된 것 입니다. 
영업장 종료 한달전 타 지점으로 배치를 고려하였으나 출퇴근 거리가 멀어 부득이하게 퇴사를 하게 되었습니다. 전 업무과정에 있어 착오로 문제가 된 적이 있어 그 후 업무에 대해서는 공단측에 유선으로 전화하여 앞의 내용을 말씀드리고 상실사유 여부를 문의한 뒤 공단측에서는 이분들은 계약만료로 신고하라는 직원의 안내를 받고 계약만료로 신고하게 되었습니다. 

즉 해당 근로계약관계종료는 회사 와 거래처 간 위수탁계약만료 및 해지로 해당 거래처에서 근무하고 있던 정규직 직원의 근무지를 조정하려는 상황에서 불가피한 사유로 발생한 직원 본인의 퇴직인 것이고 해당 직원의 근로계약기간 만료로 퇴사한 것이 아닌것입니다. 

당시 회사에서는 고용보험 상실신고 코드에 대한 배경지식이 없던 상황이었고 고용센터의 안내에 따라 상실신고를 할 수 밖에 없는 상황이며 많은 타회사 역시 담당자들이 그렇게 처리하는 것으로 알고 있습니다. 

결국 고용센터 담당자분께서 해당 직원의 퇴사의 실질이 정규직 직원의 출퇴근거리에 의한 불가피한 퇴직임에도 계약직의 근로계약만료로 인한 퇴직으로 오인하고 잘못 안내를 한 것입니다. 
계약만료는 직원과의 계약만료가 아니라 회사와 거래처간 위수탁계약 관계의 계약만료였습니다.

이러한 고용센터 담당자분의 과실로 인해 벌어진 상황을 회사가 모두 떠안는 것은 부당하다고 밖에 볼 수 없습니다.  

또한 정확하지 않은 업무에 대해 공단측에 확인하고 업무처리를 하는 모든 회사에서는 어떻게 믿고 업무처리를 할 수 있는지 불안합니다.
현재 담당자인 저 또한 이 통지를 받고 이내용에 대해 설명을 하고 상실사유 선택을 문의하였으나 같은 계약만료로 신고하라는 안내를 받았습니다.

2019년 6월17일 중부지방고용노동청 고양지청장으로부터 고용안정지원금 지급관련 자료 제출요청을 받고 증명할 수 있는 모든 자료를 제출하고 출석요구까지 받고 다녀왔습니다.
제출서류근로계약서퇴직원사업주 문답서근로자 진술서

담당자인 *** 수사관은 처음부터 다시 확인을 한 결과 기업지원팀 담당자가 업무처리를 미흡하게 처리하여 나가지 말았어야 하는 지원금이 나갔다고 합니다. 
심사 후 지원금이 지급되지 않았으면 안했지 안되는 것을 지급하는건 더 어려운일이라 보입니다.. 
본청에서는 용역직에 대한 별도 지침이 있었다고 수사관이 안내하였습니다. 그렇다면 그 당시  담당자 및 상위 관리자 또한 검토하고 지급결정을 했을 거라 판단되어집니다.
그러나 *** 수사관은 본청에서 내려온 지침에 대해 담당자가 미흡하게 업무처리를 하여 지급이 되어진거라고 판단을 하였습니다. 이 부분은 담당자가 바뀔 때 마다 업무 처리가 틀려진다는 것으로 밖에 받아들여지지 않습니다. 담당자의 실수가 있었기 때문에 고양지청 *** 수사관은 회수처분으로 결정을 하게 되었다고 합니다 
귀사에서는 증명할수 있는 모든 의견서들을 제출하였음에도 불구하고 너무 억울하여 이의신청을 합니다. 

대한민국의 모든 기업들이 안내를 받고 지시대로 업무처리를 하였음에도 불구하고 시간이 흐른 뒤 담당자의 실수였다고 하면 어떻게 믿고 업무처리를 문의할 수 있는지 의문이 듭니다. 
또한 고용촉진 대상자를 채용목적을 두고 지원금을 받지만 이러한 상황이 되면 누가 이 대상자들을 채용할 수 있을까요?

위와 같은 사항에 대해 다시금 검토를 간청드리며 지원금 전액회수에 대해 재고 및 재검토를 부탁드립니다."
104,"5,940",인권/성평등,2019-10-30,문재인 대통령 모친의 시신 운구 장면을 여과없이 방송에 송출한 sbskbsmbc 기자들 징계 처리하십시오.,"저녁 뉴스를 보다 깜짝 놀랐습니다.
제 눈을 의심했습니다.
불과 몇 주 전 모 연예인의 시신 운구 장면을 찍겠다고 득달같이 달려드는 기자들의 모습이 크게 논란이 되었음에도 불구하고 학습능력은 없었습니다.
아 이게 그들의 저널리즘이지 싶기도 했습니다.
이게 그들 수준의 인권의식이지 이해도 갑니다.
하지만 용서는 안됩니다.
현장에서 플래쉬를 터트리며 찍는 기자들 그걸 편집하고 목소리를 따 내보낸 데스크 텅빈 눈으로 그저 앵커멘트 읽기 바쁜 뉴스 앵커들 모두 공범이자 인격살인범들입니다.
고인을 보내드릴 때는 지위여하를 막론하고
조용히 보내드리는게 상식적인 예의 아닙니까?
그 정도 지적수준 우리 기자님들께 바라는 건 너무나 큰 욕심입니까?
카메라를 잠시 내리고 그저 애도의 뜻을 보내는 일이 치열한 취재경쟁 속에서는 너무나 큰 용기가 필요한 일입니까?
당신들만의 그 경쟁에서 살아남기 위해 인간임을 포기한 모습을 시청자들이 왜 목도해야합니까?
지상파라는 타이틀을 달고 뉴스를 한다면 적어도 이럴 때만이라도 차이를 보여주십시오.
평소 그 눈 뒤집힌 데스킹으로 내보내온 뉴스들의 결과가 이렇게 참담하게 드러나는거 아닙니까.
고인과 유가족뿐 아닌 시청자들에게 조차 너무나 잔인하고 폭력적이기에 처음 청원글이라는 걸 작성합니다.
이것 뿐이 당신들에게 고함지를 수단이 없기에.
sbs kbs mbc 앵커들은 저녁뉴스에서 고인 유가족 시청자에게 사과하고 이를 내보낸 기자들 징계 처리 하십시오.
그리고 마지막 부탁이 있다면 짐승임을 자처하지 마십시오 제발."
105,232,기타,2019-10-30,sh서울주택도시공사는 진정한 공기업 맞습니까?,"저는 서울시 중랑구의 신내12단지아파트에 거주하는 사람입니다.
우리아파트는 1000세대 중 절반이상이 독거노인 또는 장애를 가진 사람들이 거주하는 영구임대 아파트입니다.
저 또한 지체장애로 인해 거동이 상당히 불편하여 관리사무소의 도움을 그동안 많이 받아왔습니다.
형광등 하나도 제 힘으로는 교체할 수 없어 관리사무소의 도움을 받습니다. 어느날은 제가 심한 변비로 인해 변기가 막혀 난감해 할 때에도 관리사무소 직원들은 항상 웃는 낯으로 도와주었고 제가 자다가도 갑자기 경련이 오는데 그럴때에도 관리사무소에 전화하면 득달같이 달려와 제 몸을 주물러 살아난 것이 몇번인가 모릅니다. 또 지난달에는 관리소장님이 저희집에 방문하여 봉투를 주시는 겁니다. 그 봉투속에는 현금 6만원이 들어있었습니다. 깜짝놀라 관리소장님께 뭐냐고 물으니 매월 관리사무소 직원들이 십시일반 모아서 어려운분들께 드린다고 합니다. 세상에 이런 관리사무소 보셨습니까?
그렇게 관리사무소 직원들과는 한 가족같이 지냈는데 요즘 안좋은 소식이 들립니다.
위탁관리회사의 변경으로 인해 관리사무소 소장님이 교체된다고 합니다. 또 다른직원들도 교체될 지 모른다고 합니다. 그 소리를 듣는 순가 가슴이 먹먹했습니다. 그분들도 한가정의 가장들일텐데 .. 한순간에 직장을 잃는것입니다.
한편으로는 참 어처구니가 없는일이 아닐 수 없습니다. 그분들의 급여는 우리 주민들이 주고있는데 우리 주민들과는 아무런 협의없이 일방적으로 그분들을 교체하는 것이 있을 수 있는일입니까?용역회사가 관리사무소 직원들 월급줍니까? 그분들이 월급은 엄연히 우리 주민들이 내고 있습니다!
또 서울주택도시공사와 용역회사가 맺은 계약서에는 관리소장님 포함 관리사무소 직원들을 고용승계한다는 조항이 있는것으로 알고 있습니다. 계약서는 서로가 지키라고 있는것 아닙니까? 
서울주택도시공사는 무얼하고 있는지 모르겠습니다. 정말 서민의 주거안정을 위한 공기업 맞습니까?
저는 아니 우리 신내12단지 주민들은 그간 주민의 손발이 되어준 관리소장님 및 관리사무소 직원들과 계속 같이 지내고 싶습니다. 이것은 관리사무소 직원들의 월급을 주는 우리 주민들의 권리입니다.
서울주택도시공사는 관리사무소 직원들의 고용승계에 대해 계약서 내용대로 철저히 이행해 주시고 주민들의 권리가 침해되지 않도록 해 주시기바랍니다.
첨언하건데 만약 주민들의 승인없이 관리소장 또는 관리사무소 직원들의 교체가 단행될 경우 우리주민들은 그냥 좌시하지 않을것임을 천명합니다.

이같은 일은 비단 신내12단지만의 문제가 아니며 서울시 소재 sh서울주택도시공사가 관리하는 임대아파트는 똑같은 현실일 것입니다. sh는 시정해 주시기 바랍니다!!"
106,451,인권/성평등,2019-10-30,고문경찰 처벌 특별법,"이춘재는 화성연쇄살인사건 중 8차살인사건의 진범이 자신이라고 밝혔다. 우리는 이 사건 소식을 접하면서 국가 공권력이 얼마나 무서운지 또한번 실감하게 된다. 이춘재의 자백이 사실이라면 경찰은 엉뚱한 사람을 범인으로 지목하고  고문을 통하여 20년간 옥살이를 시킨 것이다. 이러한 사실은 8차 사건으로 20년간 옥살이를 당했던 윤모씨를 통해 알려지고 있다. 만약 진짜 죄가 없는데도 억울하게 20년간 감옥살이를 했다면 이 사람의 인생은 얼마나 억울할까? 그것도 국가공무원이 국민이 낸 세금으로 출세에 눈이 멀어 국민을 고문하여 살인죄를 뒤집어 씌웠다면 이러한 사람은 살인자 보다 더 잔인한 살인자이기에 절대 용서해서는 안된다. 왜냐하면 아무런 이유없이 살인자를 만든 것은 진범을 잡을 수 있는 기회를 놓치게 했을 뿐만 아니라 한 사람의 인생을 파괴한 살인범들이기 때문이다.
이러한 고문 경찰관들을 뿌리뽑기 위해 이번 기회에 고문경찰 특별 처리법을 만들어  경찰과 검찰의 강압적인 수사방식을 반드시 개선해야 한다."
107,"12,630",기타,2019-10-30,모친상을 당하신 대통령님께 조의를 표해드리고 싶습니다.,"삼가 고인의 명복을 빕니다.

고인께서는 현대사의 모진 시련의 시간 속에서도 국민들이 훌륭한 대통령님을 만날 수 있게 낳아주시고 길러주신 분입니다. 그 삶에 감사를 드리며 천국에서 편안히 거하시기를 기도합니다.

대통령님과 영부인님 내외분은 최근 국내외의 여러 어려운 문제들로 많이 힘드실텐데 천붕의 어려움까지 겪으셨으니 지켜보는 국민의 한 사람으로 너무 가슴이 아플 따름입니다. 

가족장으로 조문을 받지 않으신다 하시니 이 청와대 게시판에 민초로써 조그맣게나마 조의를 표하고 돌아가고자 합니다."
